{
  "schema_version": 1,
  "kind": "syncmill.run-envelope",
  "run_id": "00000000-0000-4000-8000-0000000000a1",
  "created_at": "2026-07-11T00:00:00+00:00",
  "finished_at": "2026-07-11T00:03:12+00:00",
  "strategy": "route",
  "team": null,
  "task_id": "00000000-0000-4000-8000-0000000000b1",
  "agents": ["codex", "claude", "kimi-code"],
  "board": null,
  "preflight": {"status": "disabled"},
  "trace": {"status": "disabled"},
  "result": {
    "status": "completed",
    "agent_id": "codex",
    "winner": "codex",
    "exit_code": 0,
    "duration_seconds": 187.4,
    "gate_passed": null,
    "files_changed_count": 2,
    "artifact": "result.json",
    "digest": "sha256:aaaaaaaaaaaaaaaaaaaaaaaaaaaaaaaaaaaaaaaaaaaaaaaaaaaaaaaaaaaaaaaa",
    "patch_digest": "sha256:bbbbbbbbbbbbbbbbbbbbbbbbbbbbbbbbbbbbbbbbbbbbbbbbbbbbbbbbbbbbbbbb"
  },
  "degraded": []
}
